{"created_at":"2026-08-24T19:00:00.000000Z","edges":[{"created_at":"2026-08-24T19:00:00.000000Z","edge_type":"EXTRACTED_FROM","id":"g1.id.v1/edge/09f8f679dd41ad39edcb77bbbe67cc4efaa9324e4ffcd9c9b3831e7838f391bd","job_id":"g1.id.v1/job/2d84ecbcd0dc43739ee49da107d7a65547683fbc0749c7177ad11e497bc7e4d4","metadata":{},"namespace_id":"g1.id.v1/namespace/synth.example","producer":{"kind":"test","name":"fixture.builder"},"provenance_refs":[],"schema_version":"g1.edge.v1","sensitivity":"internal","source_id":"g1.id.v1/node/ea89f6b5da645dedbad2ca5ee2ce3ed28ebbd6a616fb183f55d68361e1b88162","target_id":"g1.id.v1/node/5a5edd519990e8d8b3366ae1fbddf304a3d30c3905f134baa43aaefb9c47ab63"},{"created_at":"2026-08-24T19:00:00.000000Z","edge_type":"PRODUCED_BY","id":"g1.id.v1/edge/5fccade11fa2eb8a3980657029cfb04db66cfc9fe1e3c9fdb2b499a49fb6ed18","job_id":"g1.id.v1/job/2d84ecbcd0dc43739ee49da107d7a65547683fbc0749c7177ad11e497bc7e4d4","metadata":{},"namespace_id":"g1.id.v1/namespace/synth.example","producer":{"kind":"test","name":"fixture.builder"},"provenance_refs":[],"schema_version":"g1.edge.v1","sensitivity":"internal","source_id":"g1.id.v1/node/ea89f6b5da645dedbad2ca5ee2ce3ed28ebbd6a616fb183f55d68361e1b88162","target_id":"g1.id.v1/node/a1eaf43124cc67833a7f0f377e8e2b5df20359d9c4399a4e869426056a8e6ded"},{"created_at":"2026-08-24T19:00:00.000000Z","edge_type":"CONTRADICTS","id":"g1.id.v1/edge/c826b575476637daa220e9fe8ab1aae0e1582dff2c8055b8fe2b31b59e4c6365","job_id":"g1.id.v1/job/2d84ecbcd0dc43739ee49da107d7a65547683fbc0749c7177ad11e497bc7e4d4","metadata":{},"namespace_id":"g1.id.v1/namespace/synth.example","producer":{"kind":"test","name":"fixture.builder"},"provenance_refs":[],"schema_version":"g1.edge.v1","sensitivity":"internal","source_id":"g1.id.v1/node/665cd770cfe783a3a6299c858aafd14cfc2144e347277b1f1ed7fc6279c0bff5","target_id":"g1.id.v1/node/c10a7304dd5244c19d44107478544bc99b427707e764ada5964e4da149bd67ee"},{"created_at":"2026-08-24T19:00:00.000000Z","edge_type":"SUPPORTS","id":"g1.id.v1/edge/fc4d9969e1857500e2d170105ff6a76827f128c80903dd36342d8fa1563ff82e","job_id":"g1.id.v1/job/2d84ecbcd0dc43739ee49da107d7a65547683fbc0749c7177ad11e497bc7e4d4","metadata":{},"namespace_id":"g1.id.v1/namespace/synth.example","producer":{"kind":"test","name":"fixture.builder"},"provenance_refs":[],"schema_version":"g1.edge.v1","sensitivity":"internal","source_id":"g1.id.v1/node/7eb7adf1cd21fb6f48e9bc58e03f0ed58c0c46f9c4523bb0bf4ac6c0677b0860","target_id":"g1.id.v1/node/c10a7304dd5244c19d44107478544bc99b427707e764ada5964e4da149bd67ee"}],"job_id":"g1.id.v1/job/2d84ecbcd0dc43739ee49da107d7a65547683fbc0749c7177ad11e497bc7e4d4","max_correction_attempts":1,"metadata":{"fixture":"synthetic"},"namespace_id":"g1.id.v1/namespace/synth.example","nodes":[{"created_at":"2026-08-24T19:00:00.000000Z","id":"g1.id.v1/node/5a5edd519990e8d8b3366ae1fbddf304a3d30c3905f134baa43aaefb9c47ab63","job_id":"g1.id.v1/job/2d84ecbcd0dc43739ee49da107d7a65547683fbc0749c7177ad11e497bc7e4d4","metadata":{},"namespace_id":"g1.id.v1/namespace/synth.example","node_type":"MediaArtifact","payload":{"content_hash":"eeeeeeeeeeeeeeeeeeeeeeeeeeeeeeeeeeeeeeeeeeeeeeeeeeeeeeeeeeeeeeee","display_name":"synthetic-audio-01","duration_us":3000000,"media_id":"g1.id.v1/media/9fd48c31ea4475114ebc933c3b08a596b1df1ac7d12ff8ad6440556cd115c480","mime_type":"audio/wav","uri":"artifact://synth.example/media/primary"},"producer":{"kind":"test","name":"fixture.builder"},"provenance_refs":[],"schema_version":"g1.node.v1","sensitivity":"internal"},{"created_at":"2026-08-24T19:00:00.000000Z","id":"g1.id.v1/node/665cd770cfe783a3a6299c858aafd14cfc2144e347277b1f1ed7fc6279c0bff5","job_id":"g1.id.v1/job/2d84ecbcd0dc43739ee49da107d7a65547683fbc0749c7177ad11e497bc7e4d4","metadata":{},"namespace_id":"g1.id.v1/namespace/synth.example","node_type":"AudioEvidence","payload":{"score_bp":2000,"summary":"voice_similarity"},"producer":{"kind":"test","name":"fixture.builder"},"provenance_refs":[],"schema_version":"g1.node.v1","sensitivity":"internal"},{"created_at":"2026-08-24T19:00:00.000000Z","id":"g1.id.v1/node/7eb7adf1cd21fb6f48e9bc58e03f0ed58c0c46f9c4523bb0bf4ac6c0677b0860","job_id":"g1.id.v1/job/2d84ecbcd0dc43739ee49da107d7a65547683fbc0749c7177ad11e497bc7e4d4","metadata":{},"namespace_id":"g1.id.v1/namespace/synth.example","node_type":"AudioEvidence","payload":{"score_bp":7000,"summary":"cluster_support"},"producer":{"kind":"test","name":"fixture.builder"},"provenance_refs":[],"schema_version":"g1.node.v1","sensitivity":"internal"},{"created_at":"2026-08-24T19:00:00.000000Z","id":"g1.id.v1/node/9b52bfa589b5b8170734fce928746dd0370198ec4bd49b068dbc6233a428b909","job_id":"g1.id.v1/job/2d84ecbcd0dc43739ee49da107d7a65547683fbc0749c7177ad11e497bc7e4d4","metadata":{},"namespace_id":"g1.id.v1/namespace/synth.example","node_type":"SpeakerCluster","payload":{"cluster_key":"speaker_00"},"producer":{"kind":"test","name":"fixture.builder"},"provenance_refs":[],"schema_version":"g1.node.v1","sensitivity":"internal"},{"created_at":"2026-08-24T19:00:00.000000Z","id":"g1.id.v1/node/a1eaf43124cc67833a7f0f377e8e2b5df20359d9c4399a4e869426056a8e6ded","job_id":"g1.id.v1/job/2d84ecbcd0dc43739ee49da107d7a65547683fbc0749c7177ad11e497bc7e4d4","metadata":{},"namespace_id":"g1.id.v1/namespace/synth.example","node_type":"ProcessingStep","payload":{"sequence_index":0,"step_name":"ingest"},"producer":{"kind":"test","name":"fixture.builder"},"provenance_refs":[],"schema_version":"g1.node.v1","sensitivity":"internal"},{"created_at":"2026-08-24T19:00:00.000000Z","id":"g1.id.v1/node/c10a7304dd5244c19d44107478544bc99b427707e764ada5964e4da149bd67ee","job_id":"g1.id.v1/job/2d84ecbcd0dc43739ee49da107d7a65547683fbc0749c7177ad11e497bc7e4d4","metadata":{},"namespace_id":"g1.id.v1/namespace/synth.example","node_type":"AttributionDecision","payload":{"reason_code":"conflicting_evidence","state":"CONTRADICTED","subject_id":"g1.id.v1/node/9b52bfa589b5b8170734fce928746dd0370198ec4bd49b068dbc6233a428b909"},"producer":{"kind":"test","name":"fixture.builder"},"provenance_refs":[],"schema_version":"g1.node.v1","sensitivity":"internal"},{"created_at":"2026-08-24T19:00:00.000000Z","id":"g1.id.v1/node/ea89f6b5da645dedbad2ca5ee2ce3ed28ebbd6a616fb183f55d68361e1b88162","job_id":"g1.id.v1/job/2d84ecbcd0dc43739ee49da107d7a65547683fbc0749c7177ad11e497bc7e4d4","metadata":{},"namespace_id":"g1.id.v1/namespace/synth.example","node_type":"AudioArtifact","payload":{"channels":1,"content_hash":"eeeeeeeeeeeeeeeeeeeeeeeeeeeeeeeeeeeeeeeeeeeeeeeeeeeeeeeeeeeeeeee","display_name":"synthetic-track-01","duration_us":3000000,"mime_type":"audio/wav","sample_rate_hz":16000,"uri":"artifact://synth.example/audio/track"},"producer":{"kind":"test","name":"fixture.builder"},"provenance_refs":[],"schema_version":"g1.node.v1","sensitivity":"internal"}],"producer":{"kind":"test","name":"fixture.builder"},"schema_version":"g1.graph.v1","sensitivity":"internal"}
