{"created_at":"2026-08-24T19:00:00.000000Z","edges":[{"created_at":"2026-08-24T19:00:00.000000Z","edge_type":"EXTRACTED_FROM","id":"g1.id.v1/edge/09f8f679dd41ad39edcb77bbbe67cc4efaa9324e4ffcd9c9b3831e7838f391bd","job_id":"g1.id.v1/job/2d84ecbcd0dc43739ee49da107d7a65547683fbc0749c7177ad11e497bc7e4d4","metadata":{},"namespace_id":"g1.id.v1/namespace/synth.example","producer":{"kind":"test","name":"fixture.builder"},"provenance_refs":[],"schema_version":"g1.edge.v1","sensitivity":"internal","source_id":"g1.id.v1/node/ea89f6b5da645dedbad2ca5ee2ce3ed28ebbd6a616fb183f55d68361e1b88162","target_id":"g1.id.v1/node/5a5edd519990e8d8b3366ae1fbddf304a3d30c3905f134baa43aaefb9c47ab63"},{"created_at":"2026-08-24T19:00:00.000000Z","edge_type":"DERIVED_FROM","id":"g1.id.v1/edge/3a4365fb522c5ad486674fa9de0f7c78d6d34bdfde1f5a15bc564ec5f43d66e3","job_id":"g1.id.v1/job/2d84ecbcd0dc43739ee49da107d7a65547683fbc0749c7177ad11e497bc7e4d4","metadata":{},"namespace_id":"g1.id.v1/namespace/synth.example","producer":{"kind":"test","name":"fixture.builder"},"provenance_refs":[],"schema_version":"g1.edge.v1","sensitivity":"internal","source_id":"g1.id.v1/node/65b1492661cd72cac03227398e1a733a68cb9bd2ad187992d857c8f0b32c861c","target_id":"g1.id.v1/node/c09a6e3fdc97ae2e9c648c522497867fac2fc9f5b74bd55994a031424b54abe8"},{"created_at":"2026-08-24T19:00:00.000000Z","edge_type":"CORRECTED_BY","id":"g1.id.v1/edge/4d10c29aa84f775d593064a27c722e05af1e141d5e97220c9b15bc9d43a122f2","job_id":"g1.id.v1/job/2d84ecbcd0dc43739ee49da107d7a65547683fbc0749c7177ad11e497bc7e4d4","metadata":{},"namespace_id":"g1.id.v1/namespace/synth.example","producer":{"kind":"test","name":"fixture.builder"},"provenance_refs":[],"schema_version":"g1.edge.v1","sensitivity":"internal","source_id":"g1.id.v1/node/ad8eaa592e2c00b607c53ee179fbe13932f1030c1614d05176563510d20cf67a","target_id":"g1.id.v1/node/65b1492661cd72cac03227398e1a733a68cb9bd2ad187992d857c8f0b32c861c"},{"created_at":"2026-08-24T19:00:00.000000Z","edge_type":"PRODUCED_BY","id":"g1.id.v1/edge/5fccade11fa2eb8a3980657029cfb04db66cfc9fe1e3c9fdb2b499a49fb6ed18","job_id":"g1.id.v1/job/2d84ecbcd0dc43739ee49da107d7a65547683fbc0749c7177ad11e497bc7e4d4","metadata":{},"namespace_id":"g1.id.v1/namespace/synth.example","producer":{"kind":"test","name":"fixture.builder"},"provenance_refs":[],"schema_version":"g1.edge.v1","sensitivity":"internal","source_id":"g1.id.v1/node/ea89f6b5da645dedbad2ca5ee2ce3ed28ebbd6a616fb183f55d68361e1b88162","target_id":"g1.id.v1/node/a1eaf43124cc67833a7f0f377e8e2b5df20359d9c4399a4e869426056a8e6ded"},{"created_at":"2026-08-24T19:00:00.000000Z","edge_type":"VALIDATES","id":"g1.id.v1/edge/64e6ec33021f909c8531e8a31d68d39f7ccda545249dd79976b5a807133a84c4","job_id":"g1.id.v1/job/2d84ecbcd0dc43739ee49da107d7a65547683fbc0749c7177ad11e497bc7e4d4","metadata":{},"namespace_id":"g1.id.v1/namespace/synth.example","producer":{"kind":"test","name":"fixture.builder"},"provenance_refs":[],"schema_version":"g1.edge.v1","sensitivity":"internal","source_id":"g1.id.v1/node/c09a6e3fdc97ae2e9c648c522497867fac2fc9f5b74bd55994a031424b54abe8","target_id":"g1.id.v1/node/ad8eaa592e2c00b607c53ee179fbe13932f1030c1614d05176563510d20cf67a"},{"created_at":"2026-08-24T19:00:00.000000Z","edge_type":"DERIVED_FROM","id":"g1.id.v1/edge/b2129a6bc19b6ef7b7cb1b992e168d9377db7417bc911e09c99a988f47da8a32","job_id":"g1.id.v1/job/2d84ecbcd0dc43739ee49da107d7a65547683fbc0749c7177ad11e497bc7e4d4","metadata":{},"namespace_id":"g1.id.v1/namespace/synth.example","producer":{"kind":"test","name":"fixture.builder"},"provenance_refs":[],"schema_version":"g1.edge.v1","sensitivity":"internal","source_id":"g1.id.v1/node/9419331299c954d774edf4cae60f40d63335793084d82e8f9bb88e51a9f64355","target_id":"g1.id.v1/node/ad8eaa592e2c00b607c53ee179fbe13932f1030c1614d05176563510d20cf67a"}],"job_id":"g1.id.v1/job/2d84ecbcd0dc43739ee49da107d7a65547683fbc0749c7177ad11e497bc7e4d4","max_correction_attempts":1,"metadata":{"fixture":"synthetic"},"namespace_id":"g1.id.v1/namespace/synth.example","nodes":[{"created_at":"2026-08-24T19:00:00.000000Z","id":"g1.id.v1/node/5a5edd519990e8d8b3366ae1fbddf304a3d30c3905f134baa43aaefb9c47ab63","job_id":"g1.id.v1/job/2d84ecbcd0dc43739ee49da107d7a65547683fbc0749c7177ad11e497bc7e4d4","metadata":{},"namespace_id":"g1.id.v1/namespace/synth.example","node_type":"MediaArtifact","payload":{"content_hash":"eeeeeeeeeeeeeeeeeeeeeeeeeeeeeeeeeeeeeeeeeeeeeeeeeeeeeeeeeeeeeeee","display_name":"synthetic-audio-01","duration_us":3000000,"media_id":"g1.id.v1/media/9fd48c31ea4475114ebc933c3b08a596b1df1ac7d12ff8ad6440556cd115c480","mime_type":"audio/wav","uri":"artifact://synth.example/media/primary"},"producer":{"kind":"test","name":"fixture.builder"},"provenance_refs":[],"schema_version":"g1.node.v1","sensitivity":"internal"},{"created_at":"2026-08-24T19:00:00.000000Z","id":"g1.id.v1/node/65b1492661cd72cac03227398e1a733a68cb9bd2ad187992d857c8f0b32c861c","job_id":"g1.id.v1/job/2d84ecbcd0dc43739ee49da107d7a65547683fbc0749c7177ad11e497bc7e4d4","metadata":{},"namespace_id":"g1.id.v1/namespace/synth.example","node_type":"CorrectionAttempt","payload":{"attempt_number":1,"finding_id":"g1.id.v1/node/c09a6e3fdc97ae2e9c648c522497867fac2fc9f5b74bd55994a031424b54abe8","reason_code":"validation_failed","resulting_decision_id":"g1.id.v1/node/9419331299c954d774edf4cae60f40d63335793084d82e8f9bb88e51a9f64355","target_decision_id":"g1.id.v1/node/ad8eaa592e2c00b607c53ee179fbe13932f1030c1614d05176563510d20cf67a"},"producer":{"kind":"test","name":"fixture.builder"},"provenance_refs":[],"schema_version":"g1.node.v1","sensitivity":"internal"},{"created_at":"2026-08-24T19:00:00.000000Z","id":"g1.id.v1/node/9419331299c954d774edf4cae60f40d63335793084d82e8f9bb88e51a9f64355","job_id":"g1.id.v1/job/2d84ecbcd0dc43739ee49da107d7a65547683fbc0749c7177ad11e497bc7e4d4","metadata":{},"namespace_id":"g1.id.v1/namespace/synth.example","node_type":"AttributionDecision","payload":{"reason_code":"retry_exhausted","review_reason_code":"retry_exhausted","state":"REQUIRES_REVIEW","subject_id":"g1.id.v1/node/9b52bfa589b5b8170734fce928746dd0370198ec4bd49b068dbc6233a428b909"},"producer":{"kind":"test","name":"fixture.builder"},"provenance_refs":[],"schema_version":"g1.node.v1","sensitivity":"internal"},{"created_at":"2026-08-24T19:00:00.000000Z","id":"g1.id.v1/node/9b52bfa589b5b8170734fce928746dd0370198ec4bd49b068dbc6233a428b909","job_id":"g1.id.v1/job/2d84ecbcd0dc43739ee49da107d7a65547683fbc0749c7177ad11e497bc7e4d4","metadata":{},"namespace_id":"g1.id.v1/namespace/synth.example","node_type":"SpeakerCluster","payload":{"cluster_key":"speaker_00"},"producer":{"kind":"test","name":"fixture.builder"},"provenance_refs":[],"schema_version":"g1.node.v1","sensitivity":"internal"},{"created_at":"2026-08-24T19:00:00.000000Z","id":"g1.id.v1/node/a1eaf43124cc67833a7f0f377e8e2b5df20359d9c4399a4e869426056a8e6ded","job_id":"g1.id.v1/job/2d84ecbcd0dc43739ee49da107d7a65547683fbc0749c7177ad11e497bc7e4d4","metadata":{},"namespace_id":"g1.id.v1/namespace/synth.example","node_type":"ProcessingStep","payload":{"sequence_index":0,"step_name":"ingest"},"producer":{"kind":"test","name":"fixture.builder"},"provenance_refs":[],"schema_version":"g1.node.v1","sensitivity":"internal"},{"created_at":"2026-08-24T19:00:00.000000Z","id":"g1.id.v1/node/ad8eaa592e2c00b607c53ee179fbe13932f1030c1614d05176563510d20cf67a","job_id":"g1.id.v1/job/2d84ecbcd0dc43739ee49da107d7a65547683fbc0749c7177ad11e497bc7e4d4","metadata":{},"namespace_id":"g1.id.v1/namespace/synth.example","node_type":"AttributionDecision","payload":{"reason_code":"validation_failed","state":"UNRESOLVED","subject_id":"g1.id.v1/node/9b52bfa589b5b8170734fce928746dd0370198ec4bd49b068dbc6233a428b909"},"producer":{"kind":"test","name":"fixture.builder"},"provenance_refs":[],"schema_version":"g1.node.v1","sensitivity":"internal"},{"created_at":"2026-08-24T19:00:00.000000Z","id":"g1.id.v1/node/c09a6e3fdc97ae2e9c648c522497867fac2fc9f5b74bd55994a031424b54abe8","job_id":"g1.id.v1/job/2d84ecbcd0dc43739ee49da107d7a65547683fbc0749c7177ad11e497bc7e4d4","metadata":{},"namespace_id":"g1.id.v1/namespace/synth.example","node_type":"ValidationFinding","payload":{"code":"insufficient_evidence","message":"decision lacks supporting evidence","repair_category":"attribution","severity":"error","subject_id":"g1.id.v1/node/ad8eaa592e2c00b607c53ee179fbe13932f1030c1614d05176563510d20cf67a"},"producer":{"kind":"test","name":"fixture.builder"},"provenance_refs":[],"schema_version":"g1.node.v1","sensitivity":"internal"},{"created_at":"2026-08-24T19:00:00.000000Z","id":"g1.id.v1/node/ea89f6b5da645dedbad2ca5ee2ce3ed28ebbd6a616fb183f55d68361e1b88162","job_id":"g1.id.v1/job/2d84ecbcd0dc43739ee49da107d7a65547683fbc0749c7177ad11e497bc7e4d4","metadata":{},"namespace_id":"g1.id.v1/namespace/synth.example","node_type":"AudioArtifact","payload":{"channels":1,"content_hash":"eeeeeeeeeeeeeeeeeeeeeeeeeeeeeeeeeeeeeeeeeeeeeeeeeeeeeeeeeeeeeeee","display_name":"synthetic-track-01","duration_us":3000000,"mime_type":"audio/wav","sample_rate_hz":16000,"uri":"artifact://synth.example/audio/track"},"producer":{"kind":"test","name":"fixture.builder"},"provenance_refs":[],"schema_version":"g1.node.v1","sensitivity":"internal"}],"producer":{"kind":"test","name":"fixture.builder"},"schema_version":"g1.graph.v1","sensitivity":"internal"}
