{"created_at":"2026-08-24T19:00:00.000000Z","edges":[{"created_at":"2026-08-24T19:00:00.000000Z","edge_type":"DIARIZED_AS","id":"g1.id.v1/edge/0199cecf087f6346d6027624ea9bd7695233d492b8a21211ac124778501aae52","job_id":"g1.id.v1/job/2d84ecbcd0dc43739ee49da107d7a65547683fbc0749c7177ad11e497bc7e4d4","metadata":{},"namespace_id":"g1.id.v1/namespace/synth.example","producer":{"kind":"test","name":"fixture.builder"},"provenance_refs":[],"schema_version":"g1.edge.v1","sensitivity":"internal","source_id":"g1.id.v1/node/226458b11876e95acc7d055708869d08082e9c3ce3bf53497a323baa7f0296c6","target_id":"g1.id.v1/node/ea89f6b5da645dedbad2ca5ee2ce3ed28ebbd6a616fb183f55d68361e1b88162"},{"created_at":"2026-08-24T19:00:00.000000Z","edge_type":"DIARIZED_AS","id":"g1.id.v1/edge/094f4717822362b57e78582fa242a2be37bea7ba0480507be923c9d82060c018","job_id":"g1.id.v1/job/2d84ecbcd0dc43739ee49da107d7a65547683fbc0749c7177ad11e497bc7e4d4","metadata":{},"namespace_id":"g1.id.v1/namespace/synth.example","producer":{"kind":"test","name":"fixture.builder"},"provenance_refs":[],"schema_version":"g1.edge.v1","sensitivity":"internal","source_id":"g1.id.v1/node/e043d4ed7440323b7924c590cd8190263b78d85a16bbd376d65c0c968efba700","target_id":"g1.id.v1/node/ea89f6b5da645dedbad2ca5ee2ce3ed28ebbd6a616fb183f55d68361e1b88162"},{"created_at":"2026-08-24T19:00:00.000000Z","edge_type":"EXTRACTED_FROM","id":"g1.id.v1/edge/09f8f679dd41ad39edcb77bbbe67cc4efaa9324e4ffcd9c9b3831e7838f391bd","job_id":"g1.id.v1/job/2d84ecbcd0dc43739ee49da107d7a65547683fbc0749c7177ad11e497bc7e4d4","metadata":{},"namespace_id":"g1.id.v1/namespace/synth.example","producer":{"kind":"test","name":"fixture.builder"},"provenance_refs":[],"schema_version":"g1.edge.v1","sensitivity":"internal","source_id":"g1.id.v1/node/ea89f6b5da645dedbad2ca5ee2ce3ed28ebbd6a616fb183f55d68361e1b88162","target_id":"g1.id.v1/node/5a5edd519990e8d8b3366ae1fbddf304a3d30c3905f134baa43aaefb9c47ab63"},{"created_at":"2026-08-24T19:00:00.000000Z","edge_type":"ASSIGNED_TO","id":"g1.id.v1/edge/1ec2a1d3750fec0dfd8c2e5d2a645d2e74e96bcebd5a9d60a2528b22c8f5ff29","job_id":"g1.id.v1/job/2d84ecbcd0dc43739ee49da107d7a65547683fbc0749c7177ad11e497bc7e4d4","metadata":{},"namespace_id":"g1.id.v1/namespace/synth.example","producer":{"kind":"test","name":"fixture.builder"},"provenance_refs":[],"schema_version":"g1.edge.v1","sensitivity":"internal","source_id":"g1.id.v1/node/e043d4ed7440323b7924c590cd8190263b78d85a16bbd376d65c0c968efba700","target_id":"g1.id.v1/node/9b52bfa589b5b8170734fce928746dd0370198ec4bd49b068dbc6233a428b909"},{"created_at":"2026-08-24T19:00:00.000000Z","edge_type":"ASSIGNED_TO","id":"g1.id.v1/edge/359e9fb99a2e3fef0be082360648ba898494a9d26a0f7c9996b292a44754c217","job_id":"g1.id.v1/job/2d84ecbcd0dc43739ee49da107d7a65547683fbc0749c7177ad11e497bc7e4d4","metadata":{},"namespace_id":"g1.id.v1/namespace/synth.example","producer":{"kind":"test","name":"fixture.builder"},"provenance_refs":[],"schema_version":"g1.edge.v1","sensitivity":"internal","source_id":"g1.id.v1/node/226458b11876e95acc7d055708869d08082e9c3ce3bf53497a323baa7f0296c6","target_id":"g1.id.v1/node/42726a2977cfedec4bd42e0c47699472620807b0b14f7e4f1bb2c07c81c4e8f4"},{"created_at":"2026-08-24T19:00:00.000000Z","edge_type":"PRODUCED_BY","id":"g1.id.v1/edge/5fccade11fa2eb8a3980657029cfb04db66cfc9fe1e3c9fdb2b499a49fb6ed18","job_id":"g1.id.v1/job/2d84ecbcd0dc43739ee49da107d7a65547683fbc0749c7177ad11e497bc7e4d4","metadata":{},"namespace_id":"g1.id.v1/namespace/synth.example","producer":{"kind":"test","name":"fixture.builder"},"provenance_refs":[],"schema_version":"g1.edge.v1","sensitivity":"internal","source_id":"g1.id.v1/node/ea89f6b5da645dedbad2ca5ee2ce3ed28ebbd6a616fb183f55d68361e1b88162","target_id":"g1.id.v1/node/a1eaf43124cc67833a7f0f377e8e2b5df20359d9c4399a4e869426056a8e6ded"}],"job_id":"g1.id.v1/job/2d84ecbcd0dc43739ee49da107d7a65547683fbc0749c7177ad11e497bc7e4d4","max_correction_attempts":1,"metadata":{"fixture":"synthetic"},"namespace_id":"g1.id.v1/namespace/synth.example","nodes":[{"created_at":"2026-08-24T19:00:00.000000Z","id":"g1.id.v1/node/226458b11876e95acc7d055708869d08082e9c3ce3bf53497a323baa7f0296c6","job_id":"g1.id.v1/job/2d84ecbcd0dc43739ee49da107d7a65547683fbc0749c7177ad11e497bc7e4d4","metadata":{},"namespace_id":"g1.id.v1/namespace/synth.example","node_type":"DiarizationTurn","payload":{"cluster_key":"speaker_01","span":{"end_us":2500000,"start_us":1000000}},"producer":{"kind":"test","name":"fixture.builder"},"provenance_refs":[],"schema_version":"g1.node.v1","sensitivity":"internal"},{"created_at":"2026-08-24T19:00:00.000000Z","id":"g1.id.v1/node/42726a2977cfedec4bd42e0c47699472620807b0b14f7e4f1bb2c07c81c4e8f4","job_id":"g1.id.v1/job/2d84ecbcd0dc43739ee49da107d7a65547683fbc0749c7177ad11e497bc7e4d4","metadata":{},"namespace_id":"g1.id.v1/namespace/synth.example","node_type":"SpeakerCluster","payload":{"cluster_key":"speaker_01"},"producer":{"kind":"test","name":"fixture.builder"},"provenance_refs":[],"schema_version":"g1.node.v1","sensitivity":"internal"},{"created_at":"2026-08-24T19:00:00.000000Z","id":"g1.id.v1/node/5a5edd519990e8d8b3366ae1fbddf304a3d30c3905f134baa43aaefb9c47ab63","job_id":"g1.id.v1/job/2d84ecbcd0dc43739ee49da107d7a65547683fbc0749c7177ad11e497bc7e4d4","metadata":{},"namespace_id":"g1.id.v1/namespace/synth.example","node_type":"MediaArtifact","payload":{"content_hash":"eeeeeeeeeeeeeeeeeeeeeeeeeeeeeeeeeeeeeeeeeeeeeeeeeeeeeeeeeeeeeeee","display_name":"synthetic-audio-01","duration_us":3000000,"media_id":"g1.id.v1/media/9fd48c31ea4475114ebc933c3b08a596b1df1ac7d12ff8ad6440556cd115c480","mime_type":"audio/wav","uri":"artifact://synth.example/media/primary"},"producer":{"kind":"test","name":"fixture.builder"},"provenance_refs":[],"schema_version":"g1.node.v1","sensitivity":"internal"},{"created_at":"2026-08-24T19:00:00.000000Z","id":"g1.id.v1/node/9b52bfa589b5b8170734fce928746dd0370198ec4bd49b068dbc6233a428b909","job_id":"g1.id.v1/job/2d84ecbcd0dc43739ee49da107d7a65547683fbc0749c7177ad11e497bc7e4d4","metadata":{},"namespace_id":"g1.id.v1/namespace/synth.example","node_type":"SpeakerCluster","payload":{"cluster_key":"speaker_00"},"producer":{"kind":"test","name":"fixture.builder"},"provenance_refs":[],"schema_version":"g1.node.v1","sensitivity":"internal"},{"created_at":"2026-08-24T19:00:00.000000Z","id":"g1.id.v1/node/a1eaf43124cc67833a7f0f377e8e2b5df20359d9c4399a4e869426056a8e6ded","job_id":"g1.id.v1/job/2d84ecbcd0dc43739ee49da107d7a65547683fbc0749c7177ad11e497bc7e4d4","metadata":{},"namespace_id":"g1.id.v1/namespace/synth.example","node_type":"ProcessingStep","payload":{"sequence_index":0,"step_name":"ingest"},"producer":{"kind":"test","name":"fixture.builder"},"provenance_refs":[],"schema_version":"g1.node.v1","sensitivity":"internal"},{"created_at":"2026-08-24T19:00:00.000000Z","id":"g1.id.v1/node/e043d4ed7440323b7924c590cd8190263b78d85a16bbd376d65c0c968efba700","job_id":"g1.id.v1/job/2d84ecbcd0dc43739ee49da107d7a65547683fbc0749c7177ad11e497bc7e4d4","metadata":{},"namespace_id":"g1.id.v1/namespace/synth.example","node_type":"DiarizationTurn","payload":{"cluster_key":"speaker_00","span":{"end_us":2000000,"start_us":0}},"producer":{"kind":"test","name":"fixture.builder"},"provenance_refs":[],"schema_version":"g1.node.v1","sensitivity":"internal"},{"created_at":"2026-08-24T19:00:00.000000Z","id":"g1.id.v1/node/ea89f6b5da645dedbad2ca5ee2ce3ed28ebbd6a616fb183f55d68361e1b88162","job_id":"g1.id.v1/job/2d84ecbcd0dc43739ee49da107d7a65547683fbc0749c7177ad11e497bc7e4d4","metadata":{},"namespace_id":"g1.id.v1/namespace/synth.example","node_type":"AudioArtifact","payload":{"channels":1,"content_hash":"eeeeeeeeeeeeeeeeeeeeeeeeeeeeeeeeeeeeeeeeeeeeeeeeeeeeeeeeeeeeeeee","display_name":"synthetic-track-01","duration_us":3000000,"mime_type":"audio/wav","sample_rate_hz":16000,"uri":"artifact://synth.example/audio/track"},"producer":{"kind":"test","name":"fixture.builder"},"provenance_refs":[],"schema_version":"g1.node.v1","sensitivity":"internal"}],"producer":{"kind":"test","name":"fixture.builder"},"schema_version":"g1.graph.v1","sensitivity":"internal"}
