{"created_at":"2026-08-24T19:00:00.000000Z","edges":[{"created_at":"2026-08-24T19:00:00.000000Z","edge_type":"EXTRACTED_FROM","id":"g1.id.v1/edge/09f8f679dd41ad39edcb77bbbe67cc4efaa9324e4ffcd9c9b3831e7838f391bd","job_id":"g1.id.v1/job/2d84ecbcd0dc43739ee49da107d7a65547683fbc0749c7177ad11e497bc7e4d4","metadata":{},"namespace_id":"g1.id.v1/namespace/synth.example","producer":{"kind":"test","name":"fixture.builder"},"provenance_refs":[],"schema_version":"g1.edge.v1","sensitivity":"internal","source_id":"g1.id.v1/node/ea89f6b5da645dedbad2ca5ee2ce3ed28ebbd6a616fb183f55d68361e1b88162","target_id":"g1.id.v1/node/5a5edd519990e8d8b3366ae1fbddf304a3d30c3905f134baa43aaefb9c47ab63"},{"created_at":"2026-08-24T19:00:00.000000Z","edge_type":"REVIEWED_BY","id":"g1.id.v1/edge/40b91977745a8299334d8d6126ac3c78e00c4360fdfbe5e17b6613228db2e948","job_id":"g1.id.v1/job/2d84ecbcd0dc43739ee49da107d7a65547683fbc0749c7177ad11e497bc7e4d4","metadata":{},"namespace_id":"g1.id.v1/namespace/synth.example","producer":{"kind":"test","name":"fixture.builder"},"provenance_refs":[],"schema_version":"g1.edge.v1","sensitivity":"internal","source_id":"g1.id.v1/node/4dded64290b6a83175512545fbce92f9c062f8898782f5d86c8931810a05e38f","target_id":"g1.id.v1/node/5b4fdd8dc9b985f04bfa1a65997a045c809654296af7a3b6f36deee37901f7d8"},{"created_at":"2026-08-24T19:00:00.000000Z","edge_type":"DERIVED_FROM","id":"g1.id.v1/edge/4a0b3391cfe4156e0759a745fef556e35104943653382e492988af5b6824f411","job_id":"g1.id.v1/job/2d84ecbcd0dc43739ee49da107d7a65547683fbc0749c7177ad11e497bc7e4d4","metadata":{},"namespace_id":"g1.id.v1/namespace/synth.example","producer":{"kind":"test","name":"fixture.builder"},"provenance_refs":[],"schema_version":"g1.edge.v1","sensitivity":"internal","source_id":"g1.id.v1/node/5b4fdd8dc9b985f04bfa1a65997a045c809654296af7a3b6f36deee37901f7d8","target_id":"g1.id.v1/node/4dded64290b6a83175512545fbce92f9c062f8898782f5d86c8931810a05e38f"},{"created_at":"2026-08-24T19:00:00.000000Z","edge_type":"CANDIDATE_FOR","id":"g1.id.v1/edge/555304a7f0978d23acae8275658795ada447cf67b5c1623b16dea2b7cbb24961","job_id":"g1.id.v1/job/2d84ecbcd0dc43739ee49da107d7a65547683fbc0749c7177ad11e497bc7e4d4","metadata":{},"namespace_id":"g1.id.v1/namespace/synth.example","producer":{"kind":"test","name":"fixture.builder"},"provenance_refs":[],"schema_version":"g1.edge.v1","sensitivity":"internal","source_id":"g1.id.v1/node/3ee6bb41343c1b8a004727f149fa7f883fe2b7f8a078df5ba1229f9832ec91dc","target_id":"g1.id.v1/node/9b52bfa589b5b8170734fce928746dd0370198ec4bd49b068dbc6233a428b909"},{"created_at":"2026-08-24T19:00:00.000000Z","edge_type":"PRODUCED_BY","id":"g1.id.v1/edge/5fccade11fa2eb8a3980657029cfb04db66cfc9fe1e3c9fdb2b499a49fb6ed18","job_id":"g1.id.v1/job/2d84ecbcd0dc43739ee49da107d7a65547683fbc0749c7177ad11e497bc7e4d4","metadata":{},"namespace_id":"g1.id.v1/namespace/synth.example","producer":{"kind":"test","name":"fixture.builder"},"provenance_refs":[],"schema_version":"g1.edge.v1","sensitivity":"internal","source_id":"g1.id.v1/node/ea89f6b5da645dedbad2ca5ee2ce3ed28ebbd6a616fb183f55d68361e1b88162","target_id":"g1.id.v1/node/a1eaf43124cc67833a7f0f377e8e2b5df20359d9c4399a4e869426056a8e6ded"},{"created_at":"2026-08-24T19:00:00.000000Z","edge_type":"DERIVED_FROM","id":"g1.id.v1/edge/9f377236f07965f72aca4baef716e76cc1bb7097c85c6edd768e2f161ae71c65","job_id":"g1.id.v1/job/2d84ecbcd0dc43739ee49da107d7a65547683fbc0749c7177ad11e497bc7e4d4","metadata":{},"namespace_id":"g1.id.v1/namespace/synth.example","producer":{"kind":"test","name":"fixture.builder"},"provenance_refs":[],"schema_version":"g1.edge.v1","sensitivity":"internal","source_id":"g1.id.v1/node/9bfc68a09beaa1a5216334a9bb7ba5eb57b9468e1154cb1d78c6cec08094ac09","target_id":"g1.id.v1/node/4dded64290b6a83175512545fbce92f9c062f8898782f5d86c8931810a05e38f"}],"job_id":"g1.id.v1/job/2d84ecbcd0dc43739ee49da107d7a65547683fbc0749c7177ad11e497bc7e4d4","max_correction_attempts":1,"metadata":{"fixture":"synthetic"},"namespace_id":"g1.id.v1/namespace/synth.example","nodes":[{"created_at":"2026-08-24T19:00:00.000000Z","id":"g1.id.v1/node/3ee6bb41343c1b8a004727f149fa7f883fe2b7f8a078df5ba1229f9832ec91dc","job_id":"g1.id.v1/job/2d84ecbcd0dc43739ee49da107d7a65547683fbc0749c7177ad11e497bc7e4d4","metadata":{},"namespace_id":"g1.id.v1/namespace/synth.example","node_type":"CandidateIdentity","payload":{"candidate_key":"candidate_a","display_label":"speaker_a"},"producer":{"kind":"test","name":"fixture.builder"},"provenance_refs":[],"schema_version":"g1.node.v1","sensitivity":"internal"},{"created_at":"2026-08-24T19:00:00.000000Z","id":"g1.id.v1/node/4dded64290b6a83175512545fbce92f9c062f8898782f5d86c8931810a05e38f","job_id":"g1.id.v1/job/2d84ecbcd0dc43739ee49da107d7a65547683fbc0749c7177ad11e497bc7e4d4","metadata":{},"namespace_id":"g1.id.v1/namespace/synth.example","node_type":"AttributionDecision","payload":{"reason_code":"human_required","state":"UNRESOLVED","subject_id":"g1.id.v1/node/9b52bfa589b5b8170734fce928746dd0370198ec4bd49b068dbc6233a428b909"},"producer":{"kind":"model","name":"attribution.proposer"},"provenance_refs":[],"schema_version":"g1.node.v1","sensitivity":"internal"},{"created_at":"2026-08-24T19:00:00.000000Z","id":"g1.id.v1/node/5a5edd519990e8d8b3366ae1fbddf304a3d30c3905f134baa43aaefb9c47ab63","job_id":"g1.id.v1/job/2d84ecbcd0dc43739ee49da107d7a65547683fbc0749c7177ad11e497bc7e4d4","metadata":{},"namespace_id":"g1.id.v1/namespace/synth.example","node_type":"MediaArtifact","payload":{"content_hash":"eeeeeeeeeeeeeeeeeeeeeeeeeeeeeeeeeeeeeeeeeeeeeeeeeeeeeeeeeeeeeeee","display_name":"synthetic-audio-01","duration_us":3000000,"media_id":"g1.id.v1/media/9fd48c31ea4475114ebc933c3b08a596b1df1ac7d12ff8ad6440556cd115c480","mime_type":"audio/wav","uri":"artifact://synth.example/media/primary"},"producer":{"kind":"test","name":"fixture.builder"},"provenance_refs":[],"schema_version":"g1.node.v1","sensitivity":"internal"},{"created_at":"2026-08-24T19:00:00.000000Z","id":"g1.id.v1/node/5b4fdd8dc9b985f04bfa1a65997a045c809654296af7a3b6f36deee37901f7d8","job_id":"g1.id.v1/job/2d84ecbcd0dc43739ee49da107d7a65547683fbc0749c7177ad11e497bc7e4d4","metadata":{},"namespace_id":"g1.id.v1/namespace/synth.example","node_type":"HumanReviewDecision","payload":{"note_ref":"artifact://synth.example/review/note-01","outcome":"override","replacement_decision_id":"g1.id.v1/node/9bfc68a09beaa1a5216334a9bb7ba5eb57b9468e1154cb1d78c6cec08094ac09","reviewer_id":"g1.id.v1/reviewer/reviewer.desk","target_decision_id":"g1.id.v1/node/4dded64290b6a83175512545fbce92f9c062f8898782f5d86c8931810a05e38f"},"producer":{"kind":"human","name":"reviewer.desk"},"provenance_refs":[],"schema_version":"g1.node.v1","sensitivity":"internal"},{"created_at":"2026-08-24T19:00:00.000000Z","id":"g1.id.v1/node/9b52bfa589b5b8170734fce928746dd0370198ec4bd49b068dbc6233a428b909","job_id":"g1.id.v1/job/2d84ecbcd0dc43739ee49da107d7a65547683fbc0749c7177ad11e497bc7e4d4","metadata":{},"namespace_id":"g1.id.v1/namespace/synth.example","node_type":"SpeakerCluster","payload":{"cluster_key":"speaker_00"},"producer":{"kind":"test","name":"fixture.builder"},"provenance_refs":[],"schema_version":"g1.node.v1","sensitivity":"internal"},{"created_at":"2026-08-24T19:00:00.000000Z","id":"g1.id.v1/node/9bfc68a09beaa1a5216334a9bb7ba5eb57b9468e1154cb1d78c6cec08094ac09","job_id":"g1.id.v1/job/2d84ecbcd0dc43739ee49da107d7a65547683fbc0749c7177ad11e497bc7e4d4","metadata":{},"namespace_id":"g1.id.v1/namespace/synth.example","node_type":"AttributionDecision","payload":{"reason_code":"review_override","review_reason_code":"human_required","state":"REQUIRES_REVIEW","subject_id":"g1.id.v1/node/9b52bfa589b5b8170734fce928746dd0370198ec4bd49b068dbc6233a428b909"},"producer":{"kind":"human","name":"reviewer.desk"},"provenance_refs":[],"schema_version":"g1.node.v1","sensitivity":"internal"},{"created_at":"2026-08-24T19:00:00.000000Z","id":"g1.id.v1/node/a1eaf43124cc67833a7f0f377e8e2b5df20359d9c4399a4e869426056a8e6ded","job_id":"g1.id.v1/job/2d84ecbcd0dc43739ee49da107d7a65547683fbc0749c7177ad11e497bc7e4d4","metadata":{},"namespace_id":"g1.id.v1/namespace/synth.example","node_type":"ProcessingStep","payload":{"sequence_index":0,"step_name":"ingest"},"producer":{"kind":"test","name":"fixture.builder"},"provenance_refs":[],"schema_version":"g1.node.v1","sensitivity":"internal"},{"created_at":"2026-08-24T19:00:00.000000Z","id":"g1.id.v1/node/ea89f6b5da645dedbad2ca5ee2ce3ed28ebbd6a616fb183f55d68361e1b88162","job_id":"g1.id.v1/job/2d84ecbcd0dc43739ee49da107d7a65547683fbc0749c7177ad11e497bc7e4d4","metadata":{},"namespace_id":"g1.id.v1/namespace/synth.example","node_type":"AudioArtifact","payload":{"channels":1,"content_hash":"eeeeeeeeeeeeeeeeeeeeeeeeeeeeeeeeeeeeeeeeeeeeeeeeeeeeeeeeeeeeeeee","display_name":"synthetic-track-01","duration_us":3000000,"mime_type":"audio/wav","sample_rate_hz":16000,"uri":"artifact://synth.example/audio/track"},"producer":{"kind":"test","name":"fixture.builder"},"provenance_refs":[],"schema_version":"g1.node.v1","sensitivity":"internal"}],"producer":{"kind":"test","name":"fixture.builder"},"schema_version":"g1.graph.v1","sensitivity":"internal"}
