{"created_at":"2026-08-24T19:00:00.000000Z","edges":[{"created_at":"2026-08-24T19:00:00.000000Z","edge_type":"EXTRACTED_FROM","id":"g1.id.v1/edge/09f8f679dd41ad39edcb77bbbe67cc4efaa9324e4ffcd9c9b3831e7838f391bd","job_id":"g1.id.v1/job/2d84ecbcd0dc43739ee49da107d7a65547683fbc0749c7177ad11e497bc7e4d4","metadata":{},"namespace_id":"g1.id.v1/namespace/synth.example","producer":{"kind":"test","name":"fixture.builder"},"provenance_refs":[],"schema_version":"g1.edge.v1","sensitivity":"internal","source_id":"g1.id.v1/node/ea89f6b5da645dedbad2ca5ee2ce3ed28ebbd6a616fb183f55d68361e1b88162","target_id":"g1.id.v1/node/5a5edd519990e8d8b3366ae1fbddf304a3d30c3905f134baa43aaefb9c47ab63"},{"created_at":"2026-08-24T19:00:00.000000Z","edge_type":"DIARIZED_AS","id":"g1.id.v1/edge/1943ffd2baf9628127d3acf709a4a668008972b09df533a5400e367721a1dbd7","job_id":"g1.id.v1/job/2d84ecbcd0dc43739ee49da107d7a65547683fbc0749c7177ad11e497bc7e4d4","metadata":{},"namespace_id":"g1.id.v1/namespace/synth.example","producer":{"kind":"test","name":"fixture.builder"},"provenance_refs":[],"schema_version":"g1.edge.v1","sensitivity":"internal","source_id":"g1.id.v1/node/cba959d2dba586499917c6a080940a8fe3d7809a722736e8ba1e8be5be17c416","target_id":"g1.id.v1/node/ea89f6b5da645dedbad2ca5ee2ce3ed28ebbd6a616fb183f55d68361e1b88162"},{"created_at":"2026-08-24T19:00:00.000000Z","edge_type":"DIARIZED_AS","id":"g1.id.v1/edge/370556acbd591228392af18f653950d184811bbf26bb6cc101d7387dd3558436","job_id":"g1.id.v1/job/2d84ecbcd0dc43739ee49da107d7a65547683fbc0749c7177ad11e497bc7e4d4","metadata":{},"namespace_id":"g1.id.v1/namespace/synth.example","producer":{"kind":"test","name":"fixture.builder"},"provenance_refs":[],"schema_version":"g1.edge.v1","sensitivity":"internal","source_id":"g1.id.v1/node/920cd391cf5a601f7def97318ad0020ec7177745da1f6ba6f79f468907923e95","target_id":"g1.id.v1/node/ea89f6b5da645dedbad2ca5ee2ce3ed28ebbd6a616fb183f55d68361e1b88162"},{"created_at":"2026-08-24T19:00:00.000000Z","edge_type":"PRODUCED_BY","id":"g1.id.v1/edge/5fccade11fa2eb8a3980657029cfb04db66cfc9fe1e3c9fdb2b499a49fb6ed18","job_id":"g1.id.v1/job/2d84ecbcd0dc43739ee49da107d7a65547683fbc0749c7177ad11e497bc7e4d4","metadata":{},"namespace_id":"g1.id.v1/namespace/synth.example","producer":{"kind":"test","name":"fixture.builder"},"provenance_refs":[],"schema_version":"g1.edge.v1","sensitivity":"internal","source_id":"g1.id.v1/node/ea89f6b5da645dedbad2ca5ee2ce3ed28ebbd6a616fb183f55d68361e1b88162","target_id":"g1.id.v1/node/a1eaf43124cc67833a7f0f377e8e2b5df20359d9c4399a4e869426056a8e6ded"},{"created_at":"2026-08-24T19:00:00.000000Z","edge_type":"ASSIGNED_TO","id":"g1.id.v1/edge/7fa48bb6d4bf52e3fa97b4fcf25169ed7b8b0b644b62d193080b9ce892756232","job_id":"g1.id.v1/job/2d84ecbcd0dc43739ee49da107d7a65547683fbc0749c7177ad11e497bc7e4d4","metadata":{},"namespace_id":"g1.id.v1/namespace/synth.example","producer":{"kind":"test","name":"fixture.builder"},"provenance_refs":[],"schema_version":"g1.edge.v1","sensitivity":"internal","source_id":"g1.id.v1/node/920cd391cf5a601f7def97318ad0020ec7177745da1f6ba6f79f468907923e95","target_id":"g1.id.v1/node/9b52bfa589b5b8170734fce928746dd0370198ec4bd49b068dbc6233a428b909"},{"created_at":"2026-08-24T19:00:00.000000Z","edge_type":"ASSIGNED_TO","id":"g1.id.v1/edge/f4fa37cf9d489ccae37105ae61e536695c77283e010dc36f3822ed2bc5cf5b03","job_id":"g1.id.v1/job/2d84ecbcd0dc43739ee49da107d7a65547683fbc0749c7177ad11e497bc7e4d4","metadata":{},"namespace_id":"g1.id.v1/namespace/synth.example","producer":{"kind":"test","name":"fixture.builder"},"provenance_refs":[],"schema_version":"g1.edge.v1","sensitivity":"internal","source_id":"g1.id.v1/node/cba959d2dba586499917c6a080940a8fe3d7809a722736e8ba1e8be5be17c416","target_id":"g1.id.v1/node/42726a2977cfedec4bd42e0c47699472620807b0b14f7e4f1bb2c07c81c4e8f4"}],"job_id":"g1.id.v1/job/2d84ecbcd0dc43739ee49da107d7a65547683fbc0749c7177ad11e497bc7e4d4","max_correction_attempts":1,"metadata":{"fixture":"synthetic"},"namespace_id":"g1.id.v1/namespace/synth.example","nodes":[{"created_at":"2026-08-24T19:00:00.000000Z","id":"g1.id.v1/node/279dcd5be6f1c454953c90ad7b14fba0edf190836336aae0fc52e0a3c7cce4c3","job_id":"g1.id.v1/job/2d84ecbcd0dc43739ee49da107d7a65547683fbc0749c7177ad11e497bc7e4d4","metadata":{},"namespace_id":"g1.id.v1/namespace/synth.example","node_type":"AttributionDecision","payload":{"reason_code":"insufficient_evidence","state":"UNRESOLVED","subject_id":"g1.id.v1/node/9b52bfa589b5b8170734fce928746dd0370198ec4bd49b068dbc6233a428b909"},"producer":{"kind":"test","name":"fixture.builder"},"provenance_refs":[],"schema_version":"g1.node.v1","sensitivity":"internal"},{"created_at":"2026-08-24T19:00:00.000000Z","id":"g1.id.v1/node/42726a2977cfedec4bd42e0c47699472620807b0b14f7e4f1bb2c07c81c4e8f4","job_id":"g1.id.v1/job/2d84ecbcd0dc43739ee49da107d7a65547683fbc0749c7177ad11e497bc7e4d4","metadata":{},"namespace_id":"g1.id.v1/namespace/synth.example","node_type":"SpeakerCluster","payload":{"cluster_key":"speaker_01"},"producer":{"kind":"test","name":"fixture.builder"},"provenance_refs":[],"schema_version":"g1.node.v1","sensitivity":"internal"},{"created_at":"2026-08-24T19:00:00.000000Z","id":"g1.id.v1/node/5a5edd519990e8d8b3366ae1fbddf304a3d30c3905f134baa43aaefb9c47ab63","job_id":"g1.id.v1/job/2d84ecbcd0dc43739ee49da107d7a65547683fbc0749c7177ad11e497bc7e4d4","metadata":{},"namespace_id":"g1.id.v1/namespace/synth.example","node_type":"MediaArtifact","payload":{"content_hash":"eeeeeeeeeeeeeeeeeeeeeeeeeeeeeeeeeeeeeeeeeeeeeeeeeeeeeeeeeeeeeeee","display_name":"synthetic-audio-01","duration_us":3000000,"media_id":"g1.id.v1/media/9fd48c31ea4475114ebc933c3b08a596b1df1ac7d12ff8ad6440556cd115c480","mime_type":"audio/wav","uri":"artifact://synth.example/media/primary"},"producer":{"kind":"test","name":"fixture.builder"},"provenance_refs":[],"schema_version":"g1.node.v1","sensitivity":"internal"},{"created_at":"2026-08-24T19:00:00.000000Z","id":"g1.id.v1/node/5d734d70fa798b091c44b2a4e8d93849fce7406a7668c98bbd6a2a27728c800b","job_id":"g1.id.v1/job/2d84ecbcd0dc43739ee49da107d7a65547683fbc0749c7177ad11e497bc7e4d4","metadata":{},"namespace_id":"g1.id.v1/namespace/synth.example","node_type":"AttributionDecision","payload":{"reason_code":"insufficient_evidence","state":"UNRESOLVED","subject_id":"g1.id.v1/node/42726a2977cfedec4bd42e0c47699472620807b0b14f7e4f1bb2c07c81c4e8f4"},"producer":{"kind":"test","name":"fixture.builder"},"provenance_refs":[],"schema_version":"g1.node.v1","sensitivity":"internal"},{"created_at":"2026-08-24T19:00:00.000000Z","id":"g1.id.v1/node/920cd391cf5a601f7def97318ad0020ec7177745da1f6ba6f79f468907923e95","job_id":"g1.id.v1/job/2d84ecbcd0dc43739ee49da107d7a65547683fbc0749c7177ad11e497bc7e4d4","metadata":{},"namespace_id":"g1.id.v1/namespace/synth.example","node_type":"DiarizationTurn","payload":{"cluster_key":"speaker_00","span":{"end_us":1000000,"start_us":0}},"producer":{"kind":"test","name":"fixture.builder"},"provenance_refs":[],"schema_version":"g1.node.v1","sensitivity":"internal"},{"created_at":"2026-08-24T19:00:00.000000Z","id":"g1.id.v1/node/9b52bfa589b5b8170734fce928746dd0370198ec4bd49b068dbc6233a428b909","job_id":"g1.id.v1/job/2d84ecbcd0dc43739ee49da107d7a65547683fbc0749c7177ad11e497bc7e4d4","metadata":{},"namespace_id":"g1.id.v1/namespace/synth.example","node_type":"SpeakerCluster","payload":{"cluster_key":"speaker_00"},"producer":{"kind":"test","name":"fixture.builder"},"provenance_refs":[],"schema_version":"g1.node.v1","sensitivity":"internal"},{"created_at":"2026-08-24T19:00:00.000000Z","id":"g1.id.v1/node/a1eaf43124cc67833a7f0f377e8e2b5df20359d9c4399a4e869426056a8e6ded","job_id":"g1.id.v1/job/2d84ecbcd0dc43739ee49da107d7a65547683fbc0749c7177ad11e497bc7e4d4","metadata":{},"namespace_id":"g1.id.v1/namespace/synth.example","node_type":"ProcessingStep","payload":{"sequence_index":0,"step_name":"ingest"},"producer":{"kind":"test","name":"fixture.builder"},"provenance_refs":[],"schema_version":"g1.node.v1","sensitivity":"internal"},{"created_at":"2026-08-24T19:00:00.000000Z","id":"g1.id.v1/node/cba959d2dba586499917c6a080940a8fe3d7809a722736e8ba1e8be5be17c416","job_id":"g1.id.v1/job/2d84ecbcd0dc43739ee49da107d7a65547683fbc0749c7177ad11e497bc7e4d4","metadata":{},"namespace_id":"g1.id.v1/namespace/synth.example","node_type":"DiarizationTurn","payload":{"cluster_key":"speaker_01","span":{"end_us":2200000,"start_us":1200000}},"producer":{"kind":"test","name":"fixture.builder"},"provenance_refs":[],"schema_version":"g1.node.v1","sensitivity":"internal"},{"created_at":"2026-08-24T19:00:00.000000Z","id":"g1.id.v1/node/ea89f6b5da645dedbad2ca5ee2ce3ed28ebbd6a616fb183f55d68361e1b88162","job_id":"g1.id.v1/job/2d84ecbcd0dc43739ee49da107d7a65547683fbc0749c7177ad11e497bc7e4d4","metadata":{},"namespace_id":"g1.id.v1/namespace/synth.example","node_type":"AudioArtifact","payload":{"channels":1,"content_hash":"eeeeeeeeeeeeeeeeeeeeeeeeeeeeeeeeeeeeeeeeeeeeeeeeeeeeeeeeeeeeeeee","display_name":"synthetic-track-01","duration_us":3000000,"mime_type":"audio/wav","sample_rate_hz":16000,"uri":"artifact://synth.example/audio/track"},"producer":{"kind":"test","name":"fixture.builder"},"provenance_refs":[],"schema_version":"g1.node.v1","sensitivity":"internal"}],"producer":{"kind":"test","name":"fixture.builder"},"schema_version":"g1.graph.v1","sensitivity":"internal"}
